"","X","Fecha","Titulo.Comunicado","Link","ID","Autor","Autor_G","name"
"203",202,"2012-10-19","Nuestro sueño, la paz con justicia social y soberanía","http://www.farc-ep.co/comunicado/nuestro-sueno-la-paz-con-justicia-social-y-soberania.html",220,"secretariado nacional de las farc-ep","secretariado","2012-10-19_220.txt"
"204",203,"2012-10-11","Saludo a Chávez","http://www.farc-ep.co/comunicado/saludo-a-chavez.html",219,"secretariado nacional de las farc-ep","secretariado","2012-10-11_219.txt"
"205",204,"2012-10-02","Carta abierta al Comandante Simón Trinidad","http://www.farc-ep.co/comunicado/carta-abierta-al-comandante-simon-trinidad.html",218,"secretariado nacional de las farc-ep","secretariado","2012-10-02_218.txt"
"206",205,"2012-10-01","DECLARACIÓN POLÍTICA","http://www.farc-ep.co/comunicado/declaracion-politica.html",217,"secretariado nacional de las farc-ep","secretariado","2012-10-01_217.txt"
"207",206,"2012-09-22","Evocando al Comandante Jorge Briceño en su segundo aniversario ¡Nacimos para vencer, y no para ser vencidos!","http://www.farc-ep.co/comunicado/evocando-al-comandante-jorge-briceno-en-su-segundo-aniversario-nacimos-para-vencer-y-no-para-ser-vencidos.html",216,"secretariado nacional de las farc-ep","secretariado","2012-09-22_216.txt"
"208",207,"2012-09-04","La Mesa de Conversaciones, un triunfo del clamor nacional por la paz y la solución política","http://www.farc-ep.co/comunicado/la-mesa-de-conversaciones-un-triunfo-del-clamor-nacional-por-la-paz-y-la-solucion-politica.html",215,"secretariado nacional de las farc-ep","secretariado","2012-09-04_215.txt"
"209",208,"2012-07-22","Declaración Pública: Sobre la actualidad del país.","http://www.farc-ep.co/comunicado/declaracion-publica-sobre-la-actualidad-del-pais.html",214,"secretariado nacional de las farc-ep","secretariado","2012-07-22_214.txt"
"210",209,"2012-06-08","Declaración Pública ¡Que vivan los estudiantes!","http://www.farc-ep.co/comunicado/declaracion-publica-que-vivan-los-estudiantes.html",213,"secretariado nacional de las farc-ep","secretariado","2012-06-08_213.txt"
"211",210,"2012-05-28","Regresa triunfante la palabra","http://www.farc-ep.co/comunicado/regresa-triunfante-la-palabra.html",212,"secretariado nacional de las farc-ep","secretariado","2012-05-28_212.txt"
"212",211,"2012-05-27","FARC-EP, 48 años de lucha armada rebelde","http://www.farc-ep.co/comunicado/farc-ep-48-anos-de-lucha-armada-rebelde.html",211,"secretariado nacional de las farc-ep","secretariado","2012-05-27_211.txt"
"213",212,"2012-05-26","A la gran familia fariana en nuestro 48 aniversario","http://www.farc-ep.co/comunicado/a-la-gran-familia-fariana-en-nuestro-48-aniversario.html",210,"secretariado nacional de las farc-ep","secretariado","2012-05-26_210.txt"
"214",213,"2012-03-29","Cuatro años sin el comandante Manuel: Su memoria vive en la lucha diaria de nuestro pueblo por alcanzar La Nueva Colombia","http://www.farc-ep.co/comunicado/cuatro-anos-sin-el-comandante-manuel-su-me-moria-vive-en-la-lucha-diaria-de-nuestro-pueblo-por-alcanzar-la-nueva-colombia.html",209,"secretariado nacional de las farc-ep","secretariado","2012-03-29_209.txt"
"215",214,"2012-03-26","Comunicado: Dificultades para la liberación de los 10 prisioneros de Guerra el 26 de marzo","http://www.farc-ep.co/comunicado/comunicado-dificultades-para-la-liberacion-de-los-10-prisioneros-de-guerra-el-26-de-marzo.html",208,"secretariado nacional de las farc-ep","secretariado","2012-03-26_208.txt"
"216",215,"2012-02-26","Declaración pública sobre prisioneros y retenciones","http://www.farc-ep.co/comunicado/declaracion-publica-sobre-prisioneros-y-retenciones.html",207,"secretariado nacional de las farc-ep","secretariado","2012-02-26_207.txt"
"217",216,"2012-02-22","Diez años después","http://www.farc-ep.co/comunicado/diez-anos-despues.html",206,"secretariado nacional de las farc-ep","secretariado","2012-02-22_206.txt"
"218",217,"2011-12-29","Al pueblo colombiano","http://www.farc-ep.co/comunicado/al-pueblo-colombiano.html",205,"secretariado nacional de las farc-ep","secretariado","2011-12-29_205.txt"
"219",218,"2011-08-12","SALUDO AL ENCUENTRO NACIONAL POR LA PAZ","http://www.farc-ep.co/comunicado/saludo-al-encuentro-nacional-por-la-paz.html",204,"secretariado nacional de las farc-ep","secretariado","2011-08-12_204.txt"
"220",219,"2011-05-26","47 Años de batallas por la paz de Colombia desde la resistencia armada","http://www.farc-ep.co/comunicado/47-anos-de-batallas-por-la-paz-de-colombia-desde-la-resistencia-armada.html",203,"secretariado nacional de las farc-ep","secretariado","2011-05-26_203.txt"
"221",220,"2011-04-30","¡A la calle, a protestar el 1 de mayo!","http://www.farc-ep.co/comunicado/a-la-calle-a-protestar-el-1-de-mayo.html",202,"comisión internacional de las farc-ep","otros","2011-04-30_202.txt"
"222",221,"2011-04-25","La solidaridad es un principio","http://www.farc-ep.co/comunicado/la-solidaridad-es-un-principio.html",201,"secretariado nacional de las farc-ep","secretariado","2011-04-25_201.txt"
"223",222,"2011-04-08","In Memorian","http://www.farc-ep.co/comunicado/in-memorian.html",200,"secretariado nacional de las farc-ep","secretariado","2011-04-08_200.txt"
"224",223,"2011-04-08","¡La oligarquía mató a Gaitán!","http://www.farc-ep.co/comunicado/la-oligarquia-mato-a-gaitan.html",199,"secretariado nacional de las farc-ep","secretariado","2011-04-08_199.txt"
"225",224,"2010-09-10","¡Gloria eterna al comandante Jorge Briceño, héroe del pueblo en su resistencia contra el opresor!","http://www.farc-ep.co/comunicado/gloria-eterna-al-comandante-jorge-briceno-heroe-del-pueblo-en-su-resistencia-contra-el-opresor.html",198,"secretariado nacional de las farc-ep","secretariado","2010-09-10_198.txt"
"226",225,"2010-07-21","Sobre las elecciones presidenciales","http://www.farc-ep.co/comunicado/sobre-las-elecciones-presidenciales.html",197,"secretariado nacional de las farc-ep","secretariado","2010-07-21_197.txt"
"227",226,"2010-07-20","El grito de independencia: Un grito de batalla","http://www.farc-ep.co/comunicado/el-grito-de-independencia-un-grito-de-batalla.html",196,"secretariado nacional de las farc-ep","secretariado","2010-07-20_196.txt"
"228",227,"2010-07-19","Año bicentenario del grito de independencia","http://www.farc-ep.co/comunicado/ano-bicentenario-del-grito-de-independencia.html",195,"secretariado nacional de las farc-ep","secretariado","2010-07-19_195.txt"
"229",228,"2010-05-27","Aniversario 46 de FARC-EP - Batallar por una Nueva Colombia","http://www.farc-ep.co/comunicado/aniversario-46-de-farc-ep-batallar-por-una-nueva-colombia.html",194,"secretariado nacional de las farc-ep","secretariado","2010-05-27_194.txt"
"230",229,"2009-12-23","Saludo de fin de año","http://www.farc-ep.co/comunicado/saludo-de-fin-de-ano.html",193,"secretariado nacional de las farc-ep","secretariado","2009-12-23_193.txt"
"231",230,"2009-12-08","Sobre la liberación del cabo Moncayo","http://www.farc-ep.co/comunicado/sobre-la-liberacion-del-cabo-moncayo.html",192,"secretariado nacional de las farc-ep","secretariado","2009-12-08_192.txt"
"232",231,"2009-11-13","Nuestra Patria es América","http://www.farc-ep.co/comunicado/nuestra-patria-es-america.html",191,"secretariado nacional de las farc-ep","secretariado","2009-11-13_191.txt"
"233",232,"2009-11-06","Las mentiras del comisionado Pearl","http://www.farc-ep.co/comunicado/las-mentiras-del-comisionado-pearl.html",190,"secretariado nacional de las farc-ep","secretariado","2009-11-06_190.txt"
"234",233,"2009-09-22","Anuncio liberación de Pablo Emilio Moncayo","http://www.farc-ep.co/comunicado/anuncio-liberacion-de-pablo-emilio-moncayo.html",189,"secretariado nacional de las farc-ep","secretariado","2009-09-22_189.txt"
"235",234,"2009-07-25","La invasión militar gringa","http://www.farc-ep.co/comunicado/la-invasion-militar-gringa.html",188,"secretariado nacional de las farc-ep","secretariado","2009-07-25_188.txt"
"236",235,"2009-07-23","Sobre sucesos en Honduras","http://www.farc-ep.co/comunicado/sobre-sucesos-en-honduras.html",187,"secretariado nacional de las farc-ep","secretariado","2009-07-23_187.txt"
"237",236,"2009-07-20","Veinte de julio","http://www.farc-ep.co/comunicado/veinte-de-julio.html",186,"error","otros","2009-07-20_186.txt"
"238",237,"2009-06-03","A los militares de honor","http://www.farc-ep.co/comunicado/a-los-militares-de-honor.html",185,"secretariado nacional de las farc-ep","secretariado","2009-06-03_185.txt"
"239",238,"2009-05-09","Fascismo a la criolla","http://www.farc-ep.co/comunicado/fascismo-a-la-criolla.html",184,"secretariado nacional de las farc-ep","secretariado","2009-05-09_184.txt"
"240",239,"2009-05-01","Primero de mayo","http://www.farc-ep.co/comunicado/primero-de-mayo.html",183,"secretariado nacional de las farc-ep","secretariado","2009-05-01_183.txt"
"241",240,"2009-04-01","Gestores De Traición","http://www.farc-ep.co/comunicado/gestores-de-traicion.html",182,"secretariado nacional de las farc-ep","secretariado","2009-04-01_182.txt"
"242",241,"2009-03-15","De las FARC-EP a los prisioneros de guerra","http://www.farc-ep.co/comunicado/de-las-farc-ep-a-los-prisioneros-de-guerra.html",181,"secretariado nacional de las farc-ep","secretariado","2009-03-15_181.txt"
"243",242,"2009-03-01","A un año de la partida de Raúl e Iván","http://www.farc-ep.co/comunicado/a-un-ano-de-la-partida-de-raul-e-ivan.html",180,"secretariado nacional de las farc-ep","secretariado","2009-03-01_180.txt"
"244",243,"2008-12-10","Comunicado frontera con Ecuador","http://www.farc-ep.co/comunicado/comunicado-frontera-con-ecuador.html",179,"secretariado nacional de las farc-ep","secretariado","2008-12-10_179.txt"
"245",244,"2008-12-06","Comunicado: Reajuste a la comisión del canje","http://www.farc-ep.co/comunicado/comunicado-reajuste-a-la-comision-del-canje.html",178,"secretariado nacional de las farc-ep","secretariado","2008-12-06_178.txt"
"246",245,"2008-11-06","Comunicado: La destitución de los generales y el terrorismo del estado","http://www.farc-ep.co/comunicado/comunicado-la-destitucion-de-los-generales-y-el-terrorismo-del-estado.html",177,"secretariado nacional de las farc-ep","secretariado","2008-11-06_177.txt"
"247",246,"2008-10-30","Comunicado sobre la fuga de Lzcano","http://www.farc-ep.co/comunicado/comunicado-sobre-la-fuga-de-lzcano.html",176,"secretariado nacional de las farc-ep","secretariado","2008-10-30_176.txt"
"248",247,"2008-09-20","Comunicado sobre los últimos acontecimientos","http://www.farc-ep.co/comunicado/comunicado-sobre-los-ultimos-acontecimientos.html",175,"secretariado nacional de las farc-ep","secretariado","2008-09-20_175.txt"
"249",248,"2008-08-10","Detención de Carlos García Orjuela","http://www.farc-ep.co/comunicado/detencion-de-carlos-garcia-orjuela.html",174,"secretariado nacional de las farc-ep","secretariado","2008-08-10_174.txt"
"250",249,"2008-08-04","Canje de prisioneros","http://www.farc-ep.co/comunicado/canje-de-prisioneros.html",173,"secretariado nacional de las farc-ep","secretariado","2008-08-04_173.txt"
"251",250,"2008-07-05","Comunicado sobre la traición","http://www.farc-ep.co/comunicado/comunicado-sobre-la-traicion.html",172,"secretariado nacional de las farc-ep","secretariado","2008-07-05_172.txt"
"252",251,"2008-06-26","Carta A Daniel Ortega","http://www.farc-ep.co/comunicado/carta-a-daniel-ortega.html",171,"secretariado nacional de las farc-ep","secretariado","2008-06-26_171.txt"
"253",252,"2008-05-27","44 aniversario de las FARC-EP","http://www.farc-ep.co/comunicado/44-aniversario-de-las-farc-ep.html",170,"secretariado nacional de las farc-ep","secretariado","2008-05-27_170.txt"
"254",253,"2008-05-09","Álvaro Uribe Debe Renunciar","http://www.farc-ep.co/comunicado/alvaro-uribe-debe-renunciar.html",169,"secretariado nacional de las farc-ep","secretariado","2008-05-09_169.txt"
"255",254,"2008-04-17","Comunicado sobre el canje abril 17","http://www.farc-ep.co/comunicado/comunicado-sobre-el-canje-abril-17.html",168,"secretariado nacional de las farc-ep","secretariado","2008-04-17_168.txt"
"256",255,"2008-04-04","Comunicado sobre el canje","http://www.farc-ep.co/comunicado/comunicado-sobre-el-canje.html",167,"secretariado nacional de las farc-ep","secretariado","2008-04-04_167.txt"
"257",256,"2008-03-15","Comunicado sobre los efectos del asesinato de Raúl Reyes","http://www.farc-ep.co/comunicado/comunicado-sobre-los-efectos-del-asesinato-de-raul-reyes.html",166,"secretariado nacional de las farc-ep","secretariado","2008-03-15_166.txt"
"258",257,"2008-03-08","Comunicado sobre el asesinato del camarada Iván Ríos","http://www.farc-ep.co/comunicado/comunicado-sobre-el-asesinato-del-camarada-ivan-rios.html",165,"secretariado nacional de las farc-ep","secretariado","2008-03-08_165.txt"
"259",258,"2008-03-02","Comunicado sobre la muerte del camarada Raúl Reyes","http://www.farc-ep.co/comunicado/comunicado-sobre-la-muerte-del-camarada-raul-reyes.html",164,"secretariado nacional de las farc-ep","secretariado","2008-03-02_164.txt"
"260",259,"2008-02-15","Comunicado sobre el canje","http://www.farc-ep.co/comunicado/comunicado-sobre-el-canje.html",163,"secretariado nacional de las farc-ep","secretariado","2008-02-15_163.txt"
"261",260,"2008-01-31","Comunicado liberación de los parlamentarios: Gloria Polanco de Lozada, Luís Eladio Pérez y Orlando Beltrán Cuellar","http://www.farc-ep.co/comunicado/comunicado-liberacion-de-los-parlamentarios-gloria-polanco-de-lozada-luis-eladio-perez-y-orlando-beltran-cuellar.html",162,"secretariado nacional de las farc-ep","secretariado","2008-01-31_162.txt"
"262",261,"2008-01-08","Comunicado sobre entrega de 2 rehenes","http://www.farc-ep.co/comunicado/comunicado-sobre-entrega-de-2-rehenes.html",161,"secretariado nacional de las farc-ep","secretariado","2008-01-08_161.txt"
"263",262,"2008-01-02","Comunicado sobre el secuestro de Emanuel","http://www.farc-ep.co/comunicado/comunicado-sobre-el-secuestro-de-emanuel.html",160,"secretariado nacional de las farc-ep","secretariado","2008-01-02_160.txt"
"264",263,"2008-01-01","Saludo de fin de año 2007 de FARC-EP","http://www.farc-ep.co/comunicado/saludo-de-fin-de-ano-2007-de-farc-ep.html",159,"secretariado nacional de las farc-ep","secretariado","2008-01-01_159.txt"
"265",264,"2007-11-30","Alvaro Uribe manipuló pruebas de supervivencia de prisioneros de guerra","http://www.farc-ep.co/comunicado/alvaro-uribe-manipulo-pruebas-de-supervivencia-de-prisioneros-de-guerra.html",158,"secretariado nacional de las farc-ep","secretariado","2007-11-30_158.txt"
"266",265,"2007-11-30","Ante abrumador apoyo internacional Uribe se acobarda","http://www.farc-ep.co/comunicado/ante-abrumador-apoyo-internacional-uribe-se-acobarda.html",157,"manuel marulanda vélez","otros","2007-11-30_157.txt"
"267",266,"2007-11-25","Carta de Manuel Marulanda Vélez al presidente Hugo Rafael Chávez Frías","http://www.farc-ep.co/comunicado/carta-de-manuel-marulanda-velez-a-presidente-hugo-rafael-chavez-frias.html",156,"secretariado nacional de las farc-ep","secretariado","2007-11-25_156.txt"
"268",267,"2007-08-28","Ha muerto en combate el comandante Martín Caballero","http://www.farc-ep.co/comunicado/ha-muerto-en-combate-el-comandante-martin-caballero.html",155,"comando conjunto de occidente.","otros","2007-08-28_155.txt"
"269",268,"2007-06-24","Lamentamos informar a la opinión pública que 11 diputados del Valle han muerto","http://www.farc-ep.co/comunicado/lamentamos-informar-a-la-opinion-publica-que-11-diputados-del-valle-han-muerto.html",154,"secretariado nacional de las farc-ep","secretariado","2007-06-24_154.txt"
"270",269,"2007-06-22","Comunicado el canje es producto de acuerdos","http://www.farc-ep.co/comunicado/comunicado-el-canje-es-producto-de-acuerdos.html",153,"secretariado nacional de las farc-ep","secretariado","2007-06-22_153.txt"
"271",270,"2007-05-28","Maniobra para distraer la opinión","http://www.farc-ep.co/comunicado/maniobra-para-distraer-la-opinion.html",152,"secretariado nacional de las farc-ep","secretariado","2007-05-28_152.txt"
"272",271,"2007-03-30","Carta a los mandatarios del mundo","http://www.farc-ep.co/comunicado/carta-a-los-mandatarios-del-mundo.html",151,"secretariado nacional de las farc-ep","secretariado","2007-03-30_151.txt"
"273",272,"2007-03-27","Realizada con éxito la novena Conferencia Nacional Guerrillera","http://www.farc-ep.co/comunicado/realizada-con-exito-la-novena-conferencia-nacional-guerrillera.html",150,"secretariado nacional de las farc-ep","secretariado","2007-03-27_150.txt"
"274",273,"2006-01-01","Saludo de fin de año 2005 de FARC-EP","http://www.farc-ep.co/comunicado/saludo-de-fin-de-ano-2005-de-farc-ep.html",149,"secretariado nacional de las farc-ep","secretariado","2006-01-01_149.txt"
"275",274,"2005-12-30","Con Uribe no habrá intercambio humanitario.","http://www.farc-ep.co/comunicado/con-uribe-no-habra-intercambio-humanitario.html",148,"secretariado nacional de las farc-ep","secretariado","2005-12-30_148.txt"
"276",275,"2005-10-20","Atentado Vargas Lleras y Carta a Coroneles","http://www.farc-ep.co/comunicado/atentado-vargas-lleras-y-carta-a-coroneles.html",147,"secretariado nacional de las farc-ep","secretariado","2005-10-20_147.txt"
"277",276,"2005-09-25","Carta pública sobre el intercambio de de prisioneros","http://www.farc-ep.co/comunicado/carta-publica-sobre-el-intercambio-de-de-prisioneros.html",146,"secretariado nacional de las farc-ep","secretariado","2005-09-25_146.txt"
"278",277,"2005-08-15","30 días de despeje de la fuerza publica en los municipios de florida y pradera","http://www.farc-ep.co/comunicado/30-dias-de-despeje-de-la-fuerza-publica-en-los-municipios-de-florida-y-pradera.html",145,"secretariado nacional de las farc-ep","secretariado","2005-08-15_145.txt"
"279",278,"2005-08-05","Carta abierta de las FARC-EP (Liberación de prisioneros)","http://www.farc-ep.co/comunicado/carta-abierta-de-las-farc-ep.html",144,"secretariado nacional de las farc-ep","secretariado","2005-08-05_144.txt"
"280",279,"2005-05-28","41 Aniversario de las FARC-EP","http://www.farc-ep.co/comunicado/41-aniversario-de-las-farc-ep.html",143,"secretariado nacional de las farc-ep","secretariado","2005-05-28_143.txt"
"281",280,"2005-03-28","Carta abierta al Congreso Colombiano","http://www.farc-ep.co/comunicado/carta-abierta-al-congreso-colombiano.html",142,"farc-ep","otros","2005-03-28_142.txt"
"282",281,"2005-03-14","Carta abierta a la corte suprema de justicia","http://www.farc-ep.co/comunicado/carta-abierta-a-la-corte-suprema-de-justicia.html",141,"secretariado nacional de las farc-ep","secretariado","2005-03-14_141.txt"
"283",282,"2005-02-26","Injusta extradición de Simón Trinidad a los Estados Unidos","http://www.farc-ep.co/comunicado/injusta-extradicion-de-simon-trinidad-a-los-estados-unidos.html",140,"secretariado nacional de las farc-ep","secretariado","2005-02-26_140.txt"
"284",283,"2005-02-14","Canje de prisioneros sigue inmodificable","http://www.farc-ep.co/comunicado/canje-de-prisioneros-sigue-inmodificable.html",139,"farc-ep","otros","2005-02-14_139.txt"
"285",284,"2005-02-08","Presidente Jacques Chirac","http://www.farc-ep.co/comunicado/presidente-jacques-chirac.html",138,"secretariado nacional de las farc-ep","secretariado","2005-02-08_138.txt"
"286",285,"2005-01-27","Los Derechos Humanos y el Fascista Plan Patriota.","http://www.farc-ep.co/comunicado/los-derechos-humanos-y-el-fascista-plan-patriota.html",137,"farc-ep","otros","2005-01-27_137.txt"
"287",286,"2005-01-14","Secuestro de Ricardo Téllez","http://www.farc-ep.co/comunicado/secuestro-de-ricardo-tellez.html",136,"secretariado nacional de las farc-ep","secretariado","2005-01-14_136.txt"
"288",287,"2004-12-31","Secuestro en Centro de Caracas de Ricardo Téllez","http://www.farc-ep.co/comunicado/secuestro-en-centro-de-caracas-de-ricardo-tellez.html",135,"secretariado nacional de las farc-ep","secretariado","2004-12-31_135.txt"
"289",288,"2004-12-13","Carta abierta de las FARC, Kofi Annam Secretario General de la ONU","http://www.farc-ep.co/comunicado/carta-abierta-de-las-farc-kofi-annam-secretario-general-de-la-onu.html",134,"secretariado nacional de las farc-ep","secretariado","2004-12-13_134.txt"
"290",289,"2004-11-29","Despeje de Florida y Pradera (Valle del Cauca)","http://www.farc-ep.co/comunicado/despeje-de-florida-y-pradera-valle-del-cauca.html",133,"secretariado nacional de las farc-ep","secretariado","2004-11-29_133.txt"
"291",290,"2004-09-15","Reafirmamos nuestra disposición para pactar el Canje de prisioneros","http://www.farc-ep.co/comunicado/reafirmamos-nuestra-disposicion-para-pactar-el-canje-de-prisioneros.html",132,"secretariado nacional de las farc-ep","secretariado","2004-09-15_132.txt"
"292",291,"2004-05-30","Saludo de FARC-EP al 19 Congreso del Partido Comunista Colombiano","http://www.farc-ep.co/comunicado/saludo-de-farc-ep-al-19-congreso-del-partido-comunista-colombiano.html",131,"secretariado nacional de las farc-ep","secretariado","2004-05-30_131.txt"
"293",292,"2004-02-25","Vergonzoso revés político internacional del Presidente Uribe","http://www.farc-ep.co/comunicado/vergonzoso-reves-politico-internacional-del-presidente-uribe.html",130,"secretariado nacional de las farc-ep","secretariado","2004-02-25_130.txt"
"294",293,"2003-11-30","Estado Mayor Central aumenta a 31 integrantes","http://www.farc-ep.co/comunicado/estado-mayor-central-aumenta-a-31-integrantes.html",129,"secretariado nacional de las farc-ep","secretariado","2003-11-30_129.txt"
"295",294,"2003-11-26","Pleno 2003 - Reafirmamos Nuestra Decisión De Lucha Y Confianza En El Triunfo!","http://www.farc-ep.co/comunicado/pleno-2003-reafirmamos-nuestra-decision-de-lucha-y-confianza-en-el-triunfo.html",128,"secretariado nacional de las farc-ep","secretariado","2003-11-26_128.txt"
"296",295,"2003-11-18","¡Álvaro Uribe Debe Renunciar!","http://www.farc-ep.co/comunicado/alvaro-uribe-debe-renunciar.html",127,"secretariado nacional de las farc-ep","secretariado","2003-11-18_127.txt"
"297",296,"2003-09-30","EL REFERENDO: OBRAS SON AMORES....","http://www.farc-ep.co/comunicado/el-referendo-obras-son-amores.html",126,"manuel marulanda vélez","otros","2003-09-30_126.txt"
"298",297,"2003-09-20","A Coroneles - Manuel Marulanda Vélez","http://www.farc-ep.co/comunicado/a-coroneles-manuel-marulanda-velez.html",125,"secretariado nacional de las farc-ep","secretariado","2003-09-20_125.txt"
"299",298,"2003-08-23","A muerto el Comandante Efraín Guzmán (Nariño)","http://www.farc-ep.co/comunicado/comunicado-sobre-el-camarada-narino.html",124,"secretariado nacional de las farc-ep","secretariado","2003-08-23_124.txt"
"300",299,"2003-07-30","Comunicado Conjunto de las FARC-EP y el ELN","http://www.farc-ep.co/comunicado/comunicado-conjunto-de-las-farc-ep-y-el-eln.html",123,"secretariado nacional de las farc-ep","secretariado","2003-07-30_123.txt"
"301",300,"2003-07-30","Falsas reuniones entre familiares de Ingrid Betancourt y funcionarios franceses","http://www.farc-ep.co/comunicado/falsas-reuniones-entre-familiares-de-ingrid-betancourt-y-funcionarios-franceses.html",122,"secretariado nacional de las farc-ep","secretariado","2003-07-30_122.txt"
"302",301,"2003-07-13","La estrategia de guerra total de Alvaro Uribe Vélez","http://www.farc-ep.co/comunicado/la-estrategia-de-guerra-total-de-alvaro-uribe-velez.html",121,"secretariado nacional de las farc-ep","secretariado","2003-07-13_121.txt"
"303",302,"2003-06-23","Contra la política de Alvaro Uribe de privatización de las empresas públicas","http://www.farc-ep.co/comunicado/contra-la-politica-de-alvaro-uribe-de-privatizacion-de-las-empresas-publicas.html",120,"secretariado nacional de las farc-ep","secretariado","2003-06-23_120.txt"
"304",303,"2003-05-28","¡Desde Marquetalia, Hasta La Victoria!","http://www.farc-ep.co/comunicado/desde-marquetalia-hasta-la-victoria.html",119,"secretariado nacional de las farc-ep","secretariado","2003-05-28_119.txt"
"305",304,"2003-04-27","Carta abierta de las FARC-EP a los expresidentes liberales","http://www.farc-ep.co/comunicado/carta-abierta-de-las-farc-ep-a-los-expresidentes-liberales.html",118,"secretariado nacional de las farc-ep","secretariado","2003-04-27_118.txt"
"306",305,"2003-04-07","Alvaro Uribe Vélez responsable de la muerte de prisioneros de guerra","http://www.farc-ep.co/comunicado/alvaro-uribe-velez-responsable-de-la-muerte-de-prisioneros-de-guerra.html",117,"secretariado nacional de las farc-ep","secretariado","2003-04-07_117.txt"
"307",306,"2003-03-08","FARC-EP no son responsables de lamentable hecho del Nogal","http://www.farc-ep.co/comunicado/farc-ep-no-son-responsables-de-lamentable-hecho-del-nogal.html",116,"secretariado nacional de las farc-ep","secretariado","2003-03-08_116.txt"
"308",307,"2003-03-03","Garantías de seguridad para prisioneros canjeables depende del gobierno","http://www.farc-ep.co/comunicado/garantias-de-seguridad-para-prisioneros-canjeables-depende-del-gobierno.html",115,"secretariado nacional de las farc-ep","secretariado","2003-03-03_115.txt"
"309",308,"2003-02-25","Evidente intervención militar de EE.UU en Colombia","http://www.farc-ep.co/comunicado/evidente-intervencion-militar-de-ee-uu-en-colombia.html",114,"secretariado nacional de las farc-ep","secretariado","2003-02-25_114.txt"
"310",309,"2003-02-22","Cuatro agentes de la CIA están en nuestro poder","http://www.farc-ep.co/comunicado/cuatro-agentes-de-la-cia-estan-en-nuestro-poder.html",113,"secretariado nacional de las farc-ep","secretariado","2003-02-22_113.txt"
"311",310,"2003-02-09","Gobierno se niega a definir comisión para liberación de prisioneros","http://www.farc-ep.co/comunicado/gobierno-se-niega-a-definir-comision-para-liberacion-de-prisioneros.html",112,"comisión inernacional","otros","2003-02-09_112.txt"
